{
  "assets": {
    "characters/hero.png": {
      "animations": {
        "idle_down": {
          "fps": 1.0,
          "frames": [
            [
              0,
              0
            ]
          ],
          "loop": true
        },
        "idle_left": {
          "fps": 1.0,
          "frames": [
            [
              0,
              1
            ]
          ],
          "loop": true
        },
        "idle_right": {
          "fps": 1.0,
          "frames": [
            [
              0,
              2
            ]
          ],
          "loop": true
        },
        "idle_up": {
          "fps": 1.0,
          "frames": [
            [
              0,
              3
            ]
          ],
          "loop": true
        },
        "walk_down": {
          "fps": 8.0,
          "frames": [
            [
              0,
              0
            ],
            [
              1,
              0
            ],
            [
              2,
              0
            ],
            [
              3,
              0
            ]
          ],
          "loop": true
        },
        "walk_left": {
          "fps": 8.0,
          "frames": [
            [
              0,
              1
            ],
            [
              1,
              1
            ],
            [
              2,
              1
            ],
            [
              3,
              1
            ]
          ],
          "loop": true
        },
        "walk_right": {
          "fps": 8.0,
          "frames": [
            [
              0,
              2
            ],
            [
              1,
              2
            ],
            [
              2,
              2
            ],
            [
              3,
              2
            ]
          ],
          "loop": true
        },
        "walk_up": {
          "fps": 8.0,
          "frames": [
            [
              0,
              3
            ],
            [
              1,
              3
            ],
            [
              2,
              3
            ],
            [
              3,
              3
            ]
          ],
          "loop": true
        }
      },
      "directions": 4,
      "frame": [
        16,
        24
      ],
      "grid": {
        "cell": [
          16,
          24
        ],
        "margin": [
          0,
          0
        ],
        "separation": [
          0,
          0
        ]
      },
      "origin": [
        8,
        22
      ],
      "role": "PLAYER",
      "size": [
        64,
        96
      ],
      "usage": "sprite"
    },
    "characters/npc_villager.png": {
      "animations": {
        "idle_down": {
          "fps": 1.0,
          "frames": [
            [
              0,
              0
            ]
          ],
          "loop": true
        },
        "idle_left": {
          "fps": 1.0,
          "frames": [
            [
              0,
              1
            ]
          ],
          "loop": true
        },
        "idle_right": {
          "fps": 1.0,
          "frames": [
            [
              0,
              2
            ]
          ],
          "loop": true
        },
        "idle_up": {
          "fps": 1.0,
          "frames": [
            [
              0,
              3
            ]
          ],
          "loop": true
        },
        "walk_down": {
          "fps": 8.0,
          "frames": [
            [
              0,
              0
            ],
            [
              1,
              0
            ],
            [
              2,
              0
            ],
            [
              3,
              0
            ]
          ],
          "loop": true
        },
        "walk_left": {
          "fps": 8.0,
          "frames": [
            [
              0,
              1
            ],
            [
              1,
              1
            ],
            [
              2,
              1
            ],
            [
              3,
              1
            ]
          ],
          "loop": true
        },
        "walk_right": {
          "fps": 8.0,
          "frames": [
            [
              0,
              2
            ],
            [
              1,
              2
            ],
            [
              2,
              2
            ],
            [
              3,
              2
            ]
          ],
          "loop": true
        },
        "walk_up": {
          "fps": 8.0,
          "frames": [
            [
              0,
              3
            ],
            [
              1,
              3
            ],
            [
              2,
              3
            ],
            [
              3,
              3
            ]
          ],
          "loop": true
        }
      },
      "directions": 4,
      "frame": [
        16,
        24
      ],
      "grid": {
        "cell": [
          16,
          24
        ],
        "margin": [
          0,
          0
        ],
        "separation": [
          0,
          0
        ]
      },
      "origin": [
        8,
        22
      ],
      "role": "NPC",
      "size": [
        64,
        96
      ],
      "usage": "sprite"
    },
    "enemies/slime_idle.png": {
      "animations": {
        "idle_down": {
          "fps": 4.0,
          "frames": [
            [
              0,
              0
            ],
            [
              1,
              0
            ],
            [
              2,
              0
            ],
            [
              3,
              0
            ]
          ],
          "loop": true,
          "source": "assets/packs/sample_pack/enemies/slime_idle.png"
        }
      },
      "frame": [
        16,
        16
      ],
      "grid": {
        "cell": [
          16,
          16
        ],
        "margin": [
          0,
          0
        ],
        "separation": [
          0,
          0
        ]
      },
      "origin": [
        8,
        15
      ],
      "role": "ENEMY",
      "size": [
        64,
        16
      ],
      "usage": "sprite"
    },
    "items/chest.png": {
      "animations": {
        "idle_down": {
          "fps": 8.0,
          "frames": [
            [
              0,
              0
            ],
            [
              1,
              0
            ]
          ],
          "loop": true
        }
      },
      "frame": [
        16,
        16
      ],
      "grid": {
        "cell": [
          16,
          16
        ],
        "margin": [
          0,
          0
        ],
        "separation": [
          0,
          0
        ]
      },
      "origin": [
        8,
        14
      ],
      "role": "ITEM",
      "size": [
        32,
        16
      ],
      "tags": [
        "chest"
      ],
      "usage": "sprite"
    },
    "items/coin.png": {
      "frame": [
        16,
        16
      ],
      "origin": [
        8,
        15
      ],
      "role": "ITEM",
      "size": [
        16,
        16
      ],
      "usage": "sprite"
    },
    "items/key.png": {
      "frame": [
        16,
        16
      ],
      "origin": [
        8,
        15
      ],
      "role": "ITEM",
      "size": [
        16,
        16
      ],
      "usage": "sprite"
    },
    "items/potion.png": {
      "frame": [
        16,
        16
      ],
      "origin": [
        8,
        15
      ],
      "role": "ITEM",
      "size": [
        16,
        16
      ],
      "usage": "sprite"
    },
    "items/sword.png": {
      "frame": [
        16,
        16
      ],
      "origin": [
        8,
        15
      ],
      "role": "ITEM",
      "size": [
        16,
        16
      ],
      "usage": "sprite"
    },
    "music/battle_theme.wav": {
      "audio": {
        "loop": true,
        "type": "music"
      },
      "role": "AUDIO_MUSIC",
      "usage": "audio"
    },
    "music/town_theme.wav": {
      "audio": {
        "loop": true,
        "type": "music"
      },
      "role": "AUDIO_MUSIC",
      "usage": "audio"
    },
    "objects/town.png": {
      "grid": {
        "cell": [
          16,
          16
        ],
        "margin": [
          0,
          0
        ],
        "separation": [
          0,
          0
        ]
      },
      "role": "DECORATION",
      "size": [
        192,
        160
      ],
      "tileset": "overworld",
      "usage": "tiles"
    },
    "portraits/elder.png": {
      "frame": [
        48,
        48
      ],
      "origin": [
        24,
        47
      ],
      "role": "PORTRAIT",
      "size": [
        48,
        48
      ],
      "usage": "sprite"
    },
    "sfx/cancel.wav": {
      "audio": {
        "loop": false,
        "type": "sfx"
      },
      "role": "AUDIO_SFX",
      "usage": "audio"
    },
    "sfx/chest_open.wav": {
      "audio": {
        "loop": false,
        "type": "sfx"
      },
      "role": "AUDIO_SFX",
      "usage": "audio"
    },
    "sfx/coin.wav": {
      "audio": {
        "loop": false,
        "type": "sfx"
      },
      "role": "AUDIO_SFX",
      "usage": "audio"
    },
    "sfx/confirm.wav": {
      "audio": {
        "loop": false,
        "type": "sfx"
      },
      "role": "AUDIO_SFX",
      "usage": "audio"
    },
    "sfx/cursor_blip.wav": {
      "audio": {
        "loop": false,
        "type": "sfx"
      },
      "role": "AUDIO_SFX",
      "usage": "audio"
    },
    "sfx/hit.wav": {
      "audio": {
        "loop": false,
        "type": "sfx"
      },
      "role": "AUDIO_SFX",
      "usage": "audio"
    },
    "sfx/step.wav": {
      "audio": {
        "loop": false,
        "type": "sfx"
      },
      "role": "AUDIO_SFX",
      "usage": "audio"
    },
    "sfx/swing.wav": {
      "audio": {
        "loop": false,
        "type": "sfx"
      },
      "role": "AUDIO_SFX",
      "usage": "audio"
    },
    "tilesets/ground.png": {
      "grid": {
        "cell": [
          16,
          16